{
  "$schema": "https://json-schema.org/draft/2020-12/schema",
  "$id": "https://inside-workspace.de/kapri/schema/0.9.0/kap_packing_list.schema.json",

  "title": "Packing List",

  "description": "Normative JSON Schema for S2 – Packing List Schema of the KAPRI Specification Suite.",

  "$comment": "This schema references the common data types defined by SC1 – Common Data Types.",

  "type": "object",
  "additionalProperties": false,

  "required": [
    "document_type",
    "schema_version",
    "packing_list_id",
    "files"
  ],

  "properties": {
    "document_type": {
      "type": "string",
      "const": "kap_packing_list",
      "description": "Identifies the document type."
    },

    "schema_version": {
      "type": "string",
      "const": "0.9.0",
      "description": "SC1 §4.3 Schema Version. Version of the referenced Packing List schema."
    },

    "packing_list_id": {
      "type": "string",
      "format": "uri",
      "description": "SC1 §4.5 URI. Unique identifier of the Packing List."
    },

    "files": {
      "type": "array",
      "minItems": 1,
      "description": "Collection of Package Files described by this Packing List.",
      "items": {
        "$ref": "#/$defs/file"
      }
    }
  },

  "$defs": {
    "file": {
      "type": "object",
      "description": "Structure defined by S2 §3.1 Packing List Structure. Individual properties reference the SC1 Common Data Types listed below.",
      "additionalProperties": false,

      "required": [
        "file_id",
        "path",
        "media_type",
        "size",
        "hash_algorithm",
        "hash"
      ],

      "properties": {
        "file_id": {
          "type": "string",
          "format": "uri",
          "description": "SC1 §4.18 File Identifier. Stable identifier of the Package File."
        },

        "path": {
          "type": "string",
          "description": "SC1 §4.6 File Path. Path of the Package File relative to the Package root directory."
        },

        "media_type": {
          "type": "string",
          "description": "SC1 §4.8 Media Type. RFC 6838 media type of the serialized file."
        },

        "size": {
          "type": "integer",
          "minimum": 0,
          "description": "SC1 §4.19 File Size. Size of the serialized file in bytes."
        },

        "hash_algorithm": {
          "type": "string",
          "description": "SC1 §4.11 Hash Algorithm. Cryptographic hash algorithm used to calculate the Hash."
        },

        "hash": {
          "type": "string",
          "description": "SC1 §4.10 Hash. Cryptographic digest of the serialized file."
        },

        "key_id": {
          "type": "string",
          "format": "uri",
          "description": "SC1 §4.15 Key Identifier. Identifies the symmetric File Key required to decrypt this encrypted Package File."
        },

        "annotation": {
          "type": "string",
          "description": "Optional human-readable annotation."
        }
      }
    }
  }
}
